{
  "$schema": "https://json-schema.org/draft/2020-12/schema",
  "$id": "https://claude-skills/pptx-diagram/schemas/architecture.schema.json",
  "title": "Native PPTX Architecture Diagram",
  "description": "Components are freely positioned in inches on a 13.33x7.5in (16:9) slide. Boundaries wrap a set of component ids with a computed, padded dashed frame instead of hand-picked coordinates.",
  "type": "object",
  "additionalProperties": false,
  "required": ["schema_version", "diagram_type", "meta", "components", "connections"],
  "properties": {
    "schema_version": { "const": 1 },
    "diagram_type": { "const": "architecture" },
    "meta": {
      "type": "object",
      "additionalProperties": false,
      "required": ["title"],
      "properties": {
        "title": { "type": "string", "minLength": 1 },
        "subtitle": { "type": "string" },
        "output": { "type": "string" }
      }
    },
    "components": {
      "type": "array",
      "minItems": 1,
      "items": {
        "type": "object",
        "additionalProperties": false,
        "required": ["id", "type", "label", "pos"],
        "properties": {
          "id": { "$ref": "common.schema.json#/$defs/id" },
          "type": { "$ref": "common.schema.json#/$defs/nodeType" },
          "label": { "type": "string", "minLength": 1 },
          "sublabel": { "type": "string" },
          "tag": { "type": "string" },
          "pos": { "$ref": "common.schema.json#/$defs/point" },
          "size": { "$ref": "common.schema.json#/$defs/point", "description": "[w,h] in inches; default [1.8, 0.95]" }
        }
      }
    },
    "boundaries": {
      "type": "array",
      "items": {
        "type": "object",
        "additionalProperties": false,
        "required": ["label", "wraps"],
        "properties": {
          "label": { "type": "string", "minLength": 1 },
          "wraps": { "type": "array", "minItems": 1, "items": { "$ref": "common.schema.json#/$defs/id" } },
          "color": { "$ref": "common.schema.json#/$defs/hexColor" }
        }
      }
    },
    "connections": {
      "type": "array",
      "items": {
        "type": "object",
        "additionalProperties": false,
        "required": ["from", "to", "route"],
        "properties": {
          "from": { "$ref": "common.schema.json#/$defs/id" },
          "to": { "$ref": "common.schema.json#/$defs/id" },
          "label": { "type": "string" },
          "variant": { "enum": ["default", "emphasis", "security", "dashed"] },
          "route": { "$ref": "common.schema.json#/$defs/route" },
          "bias": { "type": "number", "minimum": 0.1, "maximum": 0.9 },
          "clearY": { "type": "number", "minimum": 0.3, "maximum": 7.2, "description": "required when route is 'arc-over-top'" }
        }
      }
    },
    "cards": {
      "type": "array",
      "items": {
        "type": "object",
        "additionalProperties": false,
        "required": ["title", "items"],
        "properties": {
          "title": { "type": "string", "minLength": 1 },
          "color": { "$ref": "common.schema.json#/$defs/hexColor" },
          "items": { "type": "array", "items": { "type": "string" } }
        }
      }
    }
  }
}
