{
  "schema_version": 1,
  "diagram_type": "architecture",
  "meta": {
    "title": "온라인 쇼핑몰 주문처리 아키텍처",
    "subtitle": "클라이언트 → API 서버 → 내부 인프라 / 외부 결제 PG",
    "output": "test/output/order-processing.schema-driven.pptx"
  },
  "components": [
    { "id": "client", "type": "client", "label": "사용자", "sublabel": "브라우저", "pos": [0.4, 3.1], "size": [1.5, 1.1] },
    { "id": "web", "type": "frontend", "label": "웹 / 앱", "sublabel": "React", "pos": [2.35, 3.1], "size": [1.7, 1.1] },
    { "id": "api", "type": "backend", "label": "API 서버", "sublabel": "주문 처리", "pos": [5.9, 3.1], "size": [1.85, 1.1] },
    { "id": "db", "type": "database", "label": "주문 DB", "pos": [8.4, 1.55], "size": [1.0, 1.2] },
    { "id": "cache", "type": "cache", "label": "캐시", "sublabel": "Redis", "pos": [8.3, 3.1], "size": [1.15, 1.1] },
    { "id": "queue", "type": "queue", "label": "알림 큐", "pos": [8.3, 4.55], "size": [1.15, 1.05] },
    { "id": "pg", "type": "external", "label": "결제 PG사", "sublabel": "외부 서비스", "pos": [10.4, 3.0], "size": [2.1, 1.3] }
  ],
  "boundaries": [
    { "label": "사내 인프라 (VPC)", "wraps": ["api", "db", "cache", "queue"], "color": "F59E0B" }
  ],
  "connections": [
    { "from": "client", "to": "web", "variant": "default", "route": "straight" },
    { "from": "web", "to": "api", "variant": "emphasis", "route": "straight" },
    { "from": "api", "to": "db", "variant": "default", "route": "elbow-right", "label": "주문 저장" },
    { "from": "api", "to": "cache", "variant": "default", "route": "elbow-right" },
    { "from": "api", "to": "queue", "variant": "default", "route": "elbow-right", "label": "발송 알림" },
    { "from": "api", "to": "pg", "variant": "dashed", "route": "arc-over-top", "clearY": 1.0, "label": "결제 요청 (async)" }
  ]
}
